{"allowed_urls":["https://www.ssa.gov/OP_Home/","https://www.ssa.gov/agency/contact/mail.html","https://www.ssa.gov/agency/contact/phone.html","https://www.ssa.gov/appeals/index.html","https://www.ssa.gov/forms/","https://www.ssa.gov/fraud/","https://www.ssa.gov/myaccount/account-faqs-and-help.html","https://www.ssa.gov/myaccount/creating-an-account.html","https://www.ssa.gov/myaccount/using-your-account.html","https://www.ssa.gov/representation/"],"corpus_id":"SSA_PUBLIC_REPLAY_CORPUS_v0.1","profile_id":"SSA_PUBLIC_NONMONETARY_PROFILE_v0.1","protocol_id":"PUBLIC_REPLAY_PROTOCOL_v0.1","receipt_schema":"SSA_GATE1_RECEIPT_v0.1","required_urls":["https://www.ssa.gov/OP_Home/","https://www.ssa.gov/agency/contact/mail.html","https://www.ssa.gov/agency/contact/phone.html","https://www.ssa.gov/appeals/index.html","https://www.ssa.gov/forms/","https://www.ssa.gov/fraud/","https://www.ssa.gov/myaccount/account-faqs-and-help.html","https://www.ssa.gov/myaccount/creating-an-account.html","https://www.ssa.gov/myaccount/using-your-account.html","https://www.ssa.gov/representation/"],"scope_id":"SSA_PUBLIC_NONMONETARY_SCOPE_001_v0.1","success_status_codes":[200]}
